{"protocolVersion":1,"jobId":"Job-Unreal-01","status":"success","workerVersion":"0.1.0","engineVersion":"5.8.2","outputsPromoted":false,"artifacts":[{"artifactId":"unreal-probe","jobId":"Job-Unreal-01","role":"engine-asset","logicalReference":"project/Content/Pack/PB_WorkerProbe.uasset","target":"unreal","sha256":"79ece854ca4248e1c8692793e12e09ae7453f26c02f31ff8fc3a888a3ad125c5","byteCount":16}],"findings":[],"metrics":[],"logReferences":[],"retrySafety":"unsafe"}
