{"protocolVersion":1,"jobId":"Job-01","status":"success","workerVersion":"1.0.0","engineVersion":"6000.3.10f1","outputsPromoted":true,"artifacts":[{"artifactId":"Artifact-01","jobId":"Job-01","role":"unity-package","logicalReference":"targets/unity/Product.unitypackage","target":"unity","sha256":"0123456789abcdef0123456789abcdef0123456789abcdef0123456789abcdef","byteCount":1024}],"findings":[{"code":"UNITY_TEXTURE_ALPHA_UNUSED","severity":"warning","explanation":"The texture alpha channel is not used.","source":"unity-worker","relatedArtifactId":"Artifact-01","suggestedAction":"Review the material opacity intent.","blocksRelease":false}],"metrics":[{"metricId":"elapsed-time","value":1250.5,"unit":"milliseconds"},{"metricId":"artifact-bytes","value":1024,"unit":"bytes"}],"logReferences":["logs/unity.log"],"retrySafety":"unsafe"}
